<?xml version="1.0" encoding="utf-8"?>

<TestComplexAndSimple:document xmlns:xsi="http://www.w3.org/2001/XMLSchema-instance" xsi:schemaLocation="TestComplexAndSimple basic_types.xsd" xmlns:TestComplexAndSimple="TestComplexAndSimple">
    <TestElement1>
        <Element_string>aaaa</Element_string>
        <Element_double>100.22</Element_double>
        <Element_boolean>true</Element_boolean>
        <Element_decimal>5.55</Element_decimal>
        <Element_dateTime>2022-05-10T10:22:49.152+01:00</Element_dateTime>
        <Element_integer>-778</Element_integer>
        <Element_nonNegativeInteger>0</Element_nonNegativeInteger>
        <Element_positiveInteger>663</Element_positiveInteger>
    </TestElement1>

    <TestElement2>99A9</TestElement2>

    <TestElement3>
        <Element_string>bbbb</Element_string>
        <Element_double>464.558</Element_double>
        <Element_dateTime>2002-10-10T10:22:49.152-02:00</Element_dateTime>
    </TestElement3>
</TestComplexAndSimple:document>